{
  "artifact": {
    "base_student": "qwen-2.5-7b-instruct-compatible-router",
    "id": "pom0-issue-router-cf16c407e690",
    "sha256": "cf16c407e690a5724468d843ba1b55ef07a0f5110107c7b24881eaa860149d72",
    "summary": "Tiny issue-router student distilled from a teacher model for Polaris ModelFactory POM-0.",
    "teacher_model": "offline-fixture-teacher",
    "type": "router"
  },
  "competition_id": "pom0-model-factory-issue-router",
  "deployment": {
    "deploy_spec_path": "job-spec.json",
    "one_click_polaris_url": null,
    "status": "local_artifact"
  },
  "disqualifier_attestations": {
    "artifact_hash_matches": true,
    "does_not_count_self_deploy_as_demand": true,
    "not_leaderboard_only": true,
    "not_public_benchmark_only": true,
    "reproducible_from_job_spec": true
  },
  "metrics": {
    "latency_speedup": 5869.046584418335,
    "quality_retention": 1.0,
    "serving_cost_reduction": 1.0,
    "student_accuracy": 1.0,
    "student_artifact_bytes": 7439,
    "student_latency_ms_mean": 0.02555781383610641,
    "teacher_accuracy": 1.0,
    "teacher_eval_cost_per_item_usd": 4.44e-05,
    "teacher_eval_latency_ms_per_item": 150.0
  },
  "paths": {
    "artifact": "student_model.json",
    "job_spec": "job-spec.json",
    "report": "pom0-report.json"
  },
  "schema_version": "cathedral.pom0.submission_manifest.v1",
  "usage_attribution": {
    "artifact_event_name": "polaris.model_factory.pom0.artifact_used",
    "exclude_abuse_flagged_usage": true,
    "exclude_creator_owned_usage": true,
    "exclude_platform_owned_usage": true,
    "exclude_refunded_usage": true,
    "status": "pending"
  }
}
